id,filename,path,text,num_chars,duration,sample_rate
1,001305.wav,wavs\001305.wav,Многие деревья этого рода растут по несколько сотен лет.,56,4.075,44100
2,525301.wav,wavs\525301.wav,Об этом сообщает АКИpress со ссылкой на государственного советника по обороне Эльмурзу Сатыбалдиева.,100,7.367,44100
3,366508.wav,wavs\366508.wav,Общие затраты на Игры составят более полутора триллионов рублей.,64,4.598,44100
4,170934.wav,wavs\170934.wav,Пермский пороховой завод сорвал сроки выполнения гособоронзаказа.,65,4.676,44100
5,513025.wav,wavs\513025.wav,"Начало работы над пятым сезоном несколько раз откладывалось из-за разногласий, возникших между создателями сериала и каналом AMC.",129,9.273,44100
6,361986.wav,wavs\361986.wav,Однако были сохранены ограничения на поставки помидоров и некоторых других овощей.,82,5.564,44100
7,291923.wav,wavs\291923.wav,Духовный вождь мусульман-исмаилитов принц Ага Хан IV вложит двадцать пять миллионов долларов в возведение пятизвездочной гостиницы в Душанбе.,141,12.199,44100
8,459417.wav,wavs\459417.wav,"Как и козельская дивизия, соединение в Татищеве оснащено устаревшими ракетами УР-100НУТТХ.",90,7.523,44100
9,115118.wav,wavs\115118.wav,"При помощи этого зеркала запутывались прошедшие через него лазерные фотоны и светодиодные кванты, отраженные этим же зеркалом.",126,9.848,44100
10,345367.wav,wavs\345367.wav,"Фотографирование в верхней одежде и шарфах, закрывающих часть подбородка, запрещено.",84,6.766,44100
11,364333.wav,wavs\364333.wav,Среди мотивов покупки могут быть и другие причины.,50,3.344,44100
12,016312.wav,wavs\016312.wav,Теперь они в течение месяца должны сделать окончательные предложения.,69,4.415,44100
13,288595.wav,wavs\288595.wav,"Также ""Газпром"" планирует подать иск против Украины в стокгольмский арбитражный суд.",84,5.433,44100
14,059686.wav,wavs\059686.wav,Причиной называлось отсутствие сертификации Европейского агентства по авиационной безопасности EASA.,100,7.367,44100
15,120141.wav,wavs\120141.wav,Наркотики — «подозрительное вязкое вещество в многослойной упаковке» — обнаружили сотрудники таможни и Росгвардии.,114,8.594,44100
16,306237.wav,wavs\306237.wav,"Проснувшись, он захотел выпить, но не обнаружил ничего подходящего и решил выбраться из квартиры.",97,6.922,44100
17,358858.wav,wavs\358858.wav,"Однако завод, расположенный в России, ориентирован только на ВПК.",65,4.31,44100
18,046668.wav,wavs\046668.wav,После этого транспортные узлы перевели перевозчиков на внутренние системы регистрации.,86,5.93,44100
19,117283.wav,wavs\117283.wav,Пока что на поданный иск отреагировали только представители канадской железной дороги.,86,5.851,44100
20,308568.wav,wavs\308568.wav,Схожее по возможностям с очками Манна устройство разрабатывает Google.,70,5.042,44100
21,134558.wav,wavs\134558.wav,Оно разработано для мобильных гаджетов под управлением операционной системы iOS и доступно в магазине App Store.,112,8.124,44100
22,314772.wav,wavs\314772.wav,"Сотрудник другого банка уточнил, что сейчас идут переговоры по поводу изменения бизнес-модели «Трансаэро».",106,8.777,44100
23,469978.wav,wavs\469978.wav,"Вирус приходит на пользовательские компьютеры в виде пустого письма с вложенным файлом, маскирующимся под zip-архив.",116,8.49,44100
24,529339.wav,wavs\529339.wav,"В марте «Победа» открыла двадцать два направления, которые связали российские регионы с морскими курортами Сочи и Анапой.",121,9.091,44100
25,199215.wav,wavs\199215.wav,"На этой неделе он комментирует гонки первого этапа Кубка мира - 2011/12, проходящего в шведском Эстерсунде.",107,10.397,44100
26,333933.wav,wavs\333933.wav,"Актер был дважды прооперирован, но все еще находится в коме.",60,4.075,44100
27,266644.wav,wavs\266644.wav,"По этому поводу в больнице проводится служебное расследование, передает Reuters.",80,5.93,44100
28,501581.wav,wavs\501581.wav,"Как сообщила женщина, ей лишь прислали письмо с извинениями.",60,4.31,44100
29,524409.wav,wavs\524409.wav,"В целом, продукция агропромышленного комплекса стала в стране второй основной экспортной статьей после нефти и газа.",116,7.837,44100
30,280518.wav,wavs\280518.wav,Отток средств из паевых инвестиционных фондов ПИФов в апреле две тысячи девятого года существенно замедлился.,109,9.639,44100
31,275421.wav,wavs\275421.wav,На Украине есть три православные церкви.,40,3.004,44100
32,431939.wav,wavs\431939.wav,"Но подтверждение отвода – отдельный процесс, который продолжается.",66,4.78,44100
33,007820.wav,wavs\007820.wav,"Какие игроки, помимо капитана «Атлетико», попали под подозрение, на данный момент неизвестно.",93,7.105,44100
34,304612.wav,wavs\304612.wav,"«А пока вы все это не соблюдаете сами, но пытаетесь вести глубоко нравственную мораль, вы выглядите смешно», — отметил он.",122,8.62,44100
35,372660.wav,wavs\372660.wav,Ранее Европейский совет инициировал процедуру рассмотрения штрафов в отношении Португалии и Испании.,100,7.419,44100
36,046668.wav,wavs\046668.wav,После этого транспортные узлы перевели перевозчиков на внутренние системы регистрации.,86,5.93,44100
37,016312.wav,wavs\016312.wav,Теперь они в течение месяца должны сделать окончательные предложения.,69,4.415,44100
38,059686.wav,wavs\059686.wav,Причиной называлось отсутствие сертификации Европейского агентства по авиационной безопасности EASA.,100,7.367,44100
39,001305.wav,wavs\001305.wav,Многие деревья этого рода растут по несколько сотен лет.,56,4.075,44100
40,007820.wav,wavs\007820.wav,"Какие игроки, помимо капитана «Атлетико», попали под подозрение, на данный момент неизвестно.",93,7.105,44100
41,287060.wav,wavs\287060.wav,Государство является нетто-импортером моторного топлива и нефтехимической продукции.,84,6.4,44100
42,242640.wav,wavs\242640.wav,Современная версия официально принята на вооружение российских войск ПВО в две тысячи двенадцатом году.,103,7.34,44100
43,423950.wav,wavs\423950.wav,"Такого мнения придерживается мать действующего главы Белого дома и бывшая первая американская леди Барбара Буш, сообщает Reuters.",129,9.613,44100
44,147948.wav,wavs\147948.wav,"Кроме того, представители издающего альбом лейбла Def Jam якобы были против такого наименования.",96,7.602,44100
45,411195.wav,wavs\411195.wav,"Позже, в эпоху Холодной войны, картина была провозглашена одним из самых ярких примеров ""глубокого проникновения коммунистической заразы"" в Голливуд.",149,10.214,44100
46,273721.wav,wavs\273721.wav,тридцатого марта глава Volvo Car Russia Мальмстен спрогнозировал рост российского авторынка.,92,7.602,44100
47,388835.wav,wavs\388835.wav,Ранее также сообщалось о другом инциденте с отдыхающими в Абхазии гражданами России.,84,6.504,44100
48,081411.wav,wavs\081411.wav,Он опроверг сообщение российских СМИ о многочисленных жертвах среди боевиков.,77,5.277,44100
49,319252.wav,wavs\319252.wav,"Более того, по мнению Царенко, ""однозначно нельзя утверждать, что взрыв на Манеже - это теракт"".",96,7.523,44100
50,505407.wav,wavs\505407.wav,"В свою очередь, российская группа инспекторов планирует выполнить наблюдательные полеты на самолете наблюдения Ту-154М Лк-1 над территориями США и Канады.",154,13.871,44100
51,246099.wav,wavs\246099.wav,Исследование было проведено Mail.ru совместно с МАСМИ.,54,5.042,44100
52,162519.wav,wavs\162519.wav,"Ликвидированные бандиты опознаны как активные члены «южной» группировки, находящиеся в федеральном розыске.",107,7.941,44100
53,432844.wav,wavs\432844.wav,"Звезды выбирают имена героев мультфильмов, сериалов и своих домашних питомцев.",78,6.269,44100
54,063715.wav,wavs\063715.wav,"Арест преступников, о котором СМИ сообщили пятого ноября, состоялся еще двадцатого сентября.",92,7.367,44100
55,151990.wav,wavs\151990.wav,Человеческий фактор мог стать основной причиной столкновения двух пассажирских поездов на перегоне Хольцкирхен — Розенхайм в немецкой Баварии.,142,10.893,44100
56,494647.wav,wavs\494647.wav,"Эту прямую, без посредников, сделку с читателями писатель рассматривает как замечательный способ утереть нос издательской индустрии.",132,10.344,44100
57,384114.wav,wavs\384114.wav,Говорилось и о вреде мультфильма для детской психики.,53,3.84,44100
58,267865.wav,wavs\267865.wav,В связи с этим НТВ рассматривает возможность прекращения вещания на эту страну.,79,5.851,44100
59,251872.wav,wavs\251872.wav,Также Асад пообещал не прекращать борьбу с терроризмом и во время мирного процесса.,83,5.512,44100
60,324012.wav,wavs\324012.wav,"Также шестнадцатого марта стадию 1/8 финала преодолел мадридский ""Реал"", обыгравший французский ""Лион"".",103,9.221,44100
61,024549.wav,wavs\024549.wav,"Так, бывший замминистра транспорта Олег Скворцов отметил, что девяносто пять процентов ДТП в России происходит из-за ошибок водителей.",134,9.639,44100
62,167398.wav,wavs\167398.wav,"По предварительным данным, ранение не повлекло серьезных последствий для здоровья полицейского.",95,6.531,44100
63,281166.wav,wavs\281166.wav,"В частности, в две тысячи седьмой году корпорация Mirax Group Сергея Полонского приобрела пятизвездочный отель Sungate Port Royal в Кемере.",139,11.102,44100
64,268950.wav,wavs\268950.wav,"Как отметил глава Росавиации Александр Нерадько, в обеспечении безопасности авиагаваней «заметен прогресс».Об этом сообщает ТАСС.",129,9.691,44100
65,091713.wav,wavs\091713.wav,"Новому адвокату Николаю Титаренко, по словам Тимошенко, нужно время, чтобы ознакомиться с делом по ее словам - не меньше месяца.",128,10.344,44100
66,536000.wav,wavs\536000.wav,В настоящее время ведутся поиски хозяев розового кота.,54,4.676,44100
67,264587.wav,wavs\264587.wav,Малкин повторил личный рекорд по очкам в матче плей-офф.,56,4.18,44100
68,121427.wav,wavs\121427.wav,"На booking он есть, в google есть, а тут нет.",45,4.127,44100
69,064295.wav,wavs\064295.wav,На землю он не претендует по договору дарения он отказался и от нее.,68,4.833,44100
70,169951.wav,wavs\169951.wav,"Бдительные работники банка приняли за террориста жителя Ростова-на-Дону, который пытался покинуть свою запертую квартиру через окно.",132,9.796,44100
71,165344.wav,wavs\165344.wav,Судебный процесс по делу Хамдана начался двадцать первого июня.,63,4.728,44100
72,519701.wav,wavs\519701.wav,"На постере написано «поимел», причем буква «м» заменена на разработанный студией Лебедева логотип Московского метрополитена.",124,10.475,44100
73,051909.wav,wavs\051909.wav,Из них в активной стадии строительства находятся около сто восемьдесят проектов.,80,6.165,44100
74,137067.wav,wavs\137067.wav,"О том, что Росляков действовал в одиночку, заявил глава Крыма Сергей Аксенов, передает ТАСС.",92,6.949,44100
75,124367.wav,wavs\124367.wav,"Как отметили в Госдепе, американские и другие иностранные туристы становятся в Турции целями атак террористов.",110,8.359,44100
76,351014.wav,wavs\351014.wav,"""Ужасно слушать горстку одних и тех же песен, выкрикиваемых ночь за ночью, но как я могу отказать?",98,5.799,44100
77,280026.wav,wavs\280026.wav,"Кервьель, в частности, просил ассистента проводить фиктивные транзакции, а тот делал это, зная, что операции не санкционированы банком.",135,10.214,44100
78,302189.wav,wavs\302189.wav,Замыкает тройку Санкт-Петербург и Северо-Западный федеральный округ в целом.,76,5.616,44100
79,198131.wav,wavs\198131.wav,Всего Министерство обороны России намерено получить одиннадцать новых Ил-96.,76,6.531,44100
80,505216.wav,wavs\505216.wav,В части курса для пять класса автор учебника переходит от объяснения понятий к построению христианского мировоззрения.,118,7.889,44100
81,211651.wav,wavs\211651.wav,До сих пор отдельные законодатели и политики использовали YouTube только по собственной инициативе.,99,7.758,44100
82,423928.wav,wavs\423928.wav,"В частности, компания предлагает такую услугу, как размещение рекламы на световых панелях в ВУЗах Москвы, Петербурга и других городах.",134,10.214,44100
83,235152.wav,wavs\235152.wav,"Строительство начнется в текущем году и завершится — в 2017-м, сообщил ТАСС руководитель Федерального медико-биологического агентства ФМБА Владимир Уйба.",153,12.852,44100
84,246106.wav,wavs\246106.wav,"Четыре человека пострадали в результате пожара в жилом доме в центре Москвы, сообщает ""Интерфакс"".",98,6.504,44100
85,113367.wav,wavs\113367.wav,В нынешнем году в конкурсе приняли участие сорок пять предпринимательниц из восемь регионов России.,99,7.34,44100
86,048328.wav,wavs\048328.wav,"Пометы были оставлены в текстах современника реформатора — итальянского монаха, поэта и гуманиста Баттисты Мантовано.",117,10.162,44100
87,367721.wav,wavs\367721.wav,Убийство чернокожего подростка в Сэнфорде произошло двадцать шестого февраля.,77,5.93,44100
88,288857.wav,wavs\288857.wav,"Кроме того, члены OurMine опубликовали сообщение с хэштегом Xbox4Ever «Xbox навсегда», однако затем признались, что пошутили.",125,11.651,44100
89,416711.wav,wavs\416711.wav,"На данный момент идут обсуждения, вносятся поправки и предложения», — сказал Мединский.",87,6.687,44100
90,449560.wav,wavs\449560.wav,"Туда также попали перевозчики из Италии, Швейцарии и Индии.",59,4.963,44100
91,033447.wav,wavs\033447.wav,Сейчас показ матчей английской лиги Sky Sport ведет совместно с BBC.,68,5.512,44100
92,155612.wav,wavs\155612.wav,"Это, в частности, потребует закупок радиолокационных станций миллиметрового диапазона.",86,5.669,44100
93,339156.wav,wavs\339156.wav,"Как рассказал начальник управления по работе с персоналом «ЧТЗ-Уралтрак» Владимир Егорнин, принято решение о господдержке предприятия.",134,10.109,44100
94,060047.wav,wavs\060047.wav,После релиза шутер получил низкие оценки и не обрел популярности среди фанатов Дюка Нюкема.,91,6.949,44100
95,065737.wav,wavs\065737.wav,Объединенная авиастроительная корпорация подвела промежуточные итоги работы на авиасалоне МАКС-2011 в Жуковском.,112,9.613,44100
96,027648.wav,wavs\027648.wav,"Его слова в понедельник, восемь февраля, приводит «Интерфакс».",62,3.997,44100
97,323095.wav,wavs\323095.wav,Женщина впервые высказалась публично насчет этой темы.,54,3.997,44100
98,406193.wav,wavs\406193.wav,"По его словам, все желающие могут позвонить с подконтрольных Киеву территорий на телефон горячей линии МВД ЛНР и передать информацию.",133,10.475,44100
99,227324.wav,wavs\227324.wav,Ребенка доставили в одну из больниц города.,43,3.657,44100
100,464043.wav,wavs\464043.wav,За эту сумму туристы могут выбрать один из двух вариантов ночлега.,66,4.075,44100
101,036095.wav,wavs\036095.wav,"Физики доказали, что ключевую роль при ультразвуковой очистке играют микроскопические пузыри.",93,6.713,44100
102,037894.wav,wavs\037894.wav,Об этом заявил глава «Лукойла» Вагит Алекперов в эфире телеканала «Россия 24».,78,6.713,44100
103,361899.wav,wavs\361899.wav,"Moncrief пыталась доказать, что имеет право на 40-процентную долю в Южно-Русском месторождении газа.",100,7.001,44100
104,017555.wav,wavs\017555.wav,"Новый интерфейс доступен для всех доменных зон, в которых расположена поисковая машина Google.",94,6.269,44100
105,295914.wav,wavs\295914.wav,"Дата начала съемок проекта все еще не назначена, хотя ранее Columbia Pictures планировала начать работу над картиной летом две тысячи восьмой года.",147,10.292,44100
106,325033.wav,wavs\325033.wav,"Марихуана, которую Койтсьер и его сообщники посылали в Великобританию, имеет голландское происхождение.",103,8.96,44100
107,121455.wav,wavs\121455.wav,Его отвезли в местную клинику для оценки психического состояния и проверки на употребление наркотиков.,102,7.184,44100
108,174191.wav,wavs\174191.wav,"Он покинул страну в феврале 2014-го после насильственной смены власти, сопровождавшейся массовыми протестами в Киеве и других городах.",134,11.651,44100
109,514804.wav,wavs\514804.wav,Для обладателей возвратных билетов предельный вес бесплатного багажа составит десять килограммов.,97,7.34,44100
110,066174.wav,wavs\066174.wav,"Инфляция на две тысячи четырнадцатого годаод прогнозируется на уровне в пять процентов, на 2015-две тысячи шестнадцатого годаоды — 4,5 процента.",144,13.976,44100
111,295501.wav,wavs\295501.wav,Встреча состоялась в Кенсингтонском дворце в шестнадцать часов ноль минут тридцатого октября тысяча девятьсот девяносто пятого года.,132,11.128,44100
112,228720.wav,wavs\228720.wav,"Обязательства по контракту Northrop Grumman, как ожидается, выполнит к концу июня две тысячи девятнадцатого года.",113,8.255,44100
113,290783.wav,wavs\290783.wav,Госкорпорация «Росатом» не получала от украинской стороны никакого официального отказа от сотрудничества по проекту достройки Хмельницкой АЭС.,142,11.311,44100
114,484080.wav,wavs\484080.wav,"В июле компания сообщила, что может продать два комплекса, которые были построены шестьдесят лет назад с помощью государства.",125,8.359,44100
115,009664.wav,wavs\009664.wav,"Обвинение считает ее руководителем местной ячейки террористической сети ""Аль-Каеда"".",84,7.131,44100
