id,filename,path,text,num_chars,duration,sample_rate
1556,215961.wav,wavs\215961.wav,"Выставка бронетехники в Житомире, организованная Национальной гвардией, полицией и погранслужбой, прошла четырнадцатого октября и была приурочена к Дню защитника Украины.",170,12.617,44100
1557,242725.wav,wavs\242725.wav,"В одном случае боевики обстреляли автомобиль, в котором ехали трое поселенцев.",78,5.329,44100
1558,172589.wav,wavs\172589.wav,"По его словам, компания начала проводить исследования о «некоторых данных клиентов из Зимбабве».",96,7.131,44100
1559,508625.wav,wavs\508625.wav,Вечером двадцать третьего июля команда Кустурицы даст концерт в ялтинском концертном зале «Юбилейный».,102,8.176,44100
1560,049990.wav,wavs\049990.wav,"Представитель полиции Джаред Оливер Jared Oliver рассказал ABC News, что опыт не был частью школьного задания.",110,8.856,44100
1561,165609.wav,wavs\165609.wav,Федеральная антимонопольная служба ФАС возбудила дело против нескольких поставщиков продовольствия для нужд военных училищ.,123,8.725,44100
1562,111528.wav,wavs\111528.wav,В каждой из игр форвард забивал как минимум по голу.,52,4.206,44100
1563,046528.wav,wavs\046528.wav,"Его подозревают в получении взяток на общую сумму, эквивалентную семьсот пятьдесят тысячам долларов США.",104,7.131,44100
1564,274517.wav,wavs\274517.wav,"Представитель Форда от комментариев отказался, а с пресс-секретарем Хэмилла агентство пока связаться не сумело.",111,8.62,44100
1565,529038.wav,wavs\529038.wav,"Об этом в понедельник, девятнадцатого июня, на своей странице в Facebook сообщил депутат Верховной Рады Дмитрий Тымчук.",119,8.673,44100
1566,443623.wav,wavs\443623.wav,"Стоит также отметить, что включение ансамбля монастыря в список ЮНЕСКО практически закрывает вопрос о возможности возвращения его Церкви.",137,10.109,44100
1567,374262.wav,wavs\374262.wav,"«Упаковка разлагается раньше, чем еда.",38,2.638,44100
1568,530664.wav,wavs\530664.wav,"Об этом в пятницу, четырнадцатого декабря, сообщается на сайте МВД по Республике Ингушетия.",91,7.131,44100
1569,274988.wav,wavs\274988.wav,"Задача пуска выполнена, цикл испытаний будет продолжен», — говорится в сообщении пресс-службы.",94,8.62,44100
1570,346517.wav,wavs\346517.wav,Грузия является членом АБР с февраля две тысячи седьмой года.,61,5.094,44100
1571,538535.wav,wavs\538535.wav,Первое кафе сети было открыто в России в тысяча девятьсот девяносто второй году.,80,5.93,44100
1572,241893.wav,wavs\241893.wav,«Теперь наземная часть бункера закрыта на большой амбарный замок.,65,4.023,44100
1573,348777.wav,wavs\348777.wav,"Автор фантастической саги запретил описывать происхождение и прошлое этого героя во всех книгах, мультфильмах, играх.",117,9.273,44100
1574,191601.wav,wavs\191601.wav,"Торги индекса Topix, сделки с фьючерсами, опционами, облигациями правительства Японии и другими финансовыми инструментами возобновлены в полном объеме.",151,11.651,44100
1575,176156.wav,wavs\176156.wav,В четверг определились все участники 1/4 финала Кубка УЕФА.,59,5.329,44100
1576,291041.wav,wavs\291041.wav,"В крупной дорожной аварии, произошедшей девятнадцатого июля на автобане A2 между Пайне и Брауншвейгом, разбились двести пятьдесят девять автомобилей.",149,11.781,44100
1577,301294.wav,wavs\301294.wav,Статья с этими выводами будет опубликована в журнале The Astrophysical Journal.,79,5.433,44100
1578,264653.wav,wavs\264653.wav,"При этом для льготных категорий арендаторов будут сохранены корректирующие коэффициенты, установленные правительством Москвы.",125,8.908,44100
1579,233486.wav,wavs\233486.wav,Экипаж разбившегося в Черном море самолета Ту-154Б-2 имел значительный опыт полетов в Сирию.,92,9.038,44100
1580,447712.wav,wavs\447712.wav,"Средний уровень содержания алмазов в руде — 0,9 карата на тонну.",64,5.93,44100
1581,515128.wav,wavs\515128.wav,"С начала года цена выросла на 7,6 процента.",43,4.023,44100
1582,053128.wav,wavs\053128.wav,Об этом сообщает АГН «Москва» со ссылкой на источник в столичном главке МВД.,76,6.296,44100
1583,390707.wav,wavs\390707.wav,"До этого форварда включали в предварительную заявку команды на чемпионат мира-2018, однако в окончательный список игроков он не попал.",134,9.691,44100
1584,220564.wav,wavs\220564.wav,"Жуткое ощущение, как будто тебя сейчас съедят», — признался россиянин.",70,5.381,44100
1585,409410.wav,wavs\409410.wav,"Евразийский банк развития был создан в начале две тысячи шестой года для развития рыночной экономики государств, которые являются его соучредителями.",149,11.128,44100
1586,387768.wav,wavs\387768.wav,Высота зданий составляет сто семьдесят и сто пятьдесят метров 56 и пятьдесят этажей соответственно.,99,7.941,44100
1587,293307.wav,wavs\293307.wav,Выплаты распределяются между пятнадцать топ-менеджерами банка.,62,4.833,44100
1588,324882.wav,wavs\324882.wav,"В топ-10 в порядке убывания также включили Германию, Чехию, Молдавию, Казахстан, Испанию, Белоруссию и Францию.",111,7.941,44100
1589,475459.wav,wavs\475459.wav,"Сначала при счете 1:2 после передачи ветерана команды Скотта Меланби, Ковальчук уравнял шансы команд.",101,7.549,44100
1590,109913.wav,wavs\109913.wav,Выборы президента в Армении состоялись восемнадцатого февраля.,62,4.624,44100
1591,173850.wav,wavs\173850.wav,"«В частности, были вскрыты почтовые ящики замминистра Антона Инюцына.",69,5.799,44100
1592,144517.wav,wavs\144517.wav,"Он подготовлен для использования, например, с приложениями, работающими с потоковым видео.",90,6.4,44100
1593,339301.wav,wavs\339301.wav,"Аналитик вычел из общего количества проданных гаджетов 2,05 миллиарда количество используемых на сегодняшний день 1,3 миллиарда.",128,10.344,44100
1594,105033.wav,wavs\105033.wav,В республике уже несколько месяцев продолжается противостояние между Мадуро и оппозицией.,89,6.034,44100
1595,245238.wav,wavs\245238.wav,"На одном из финских островов готовятся открыть курорт, куда будут пускать только женщин — SuperShe.",99,6.635,44100
1596,424806.wav,wavs\424806.wav,"В процессе переговоров в прессе назывались различные варианты численности истребителей, закупаемых по Госпрограмме: от двадцать четыре до тридцать семь машин.",158,12.069,44100
1597,314995.wav,wavs\314995.wav,Это уже вторая остановка с начала две тысячи восьмой года: компании не хватает средств для поставок сырья.,106,8.307,44100
1598,091143.wav,wavs\091143.wav,Глава МЧС Сергей Шойгу распорядился оказать помощь семьям погибших при тушении пожара.,86,7.131,44100
1599,315990.wav,wavs\315990.wav,"Ее поместили под домашний арест, но спустя сутки выпустили.",59,4.676,44100
1600,160712.wav,wavs\160712.wav,"Заметив, что к ней направились полицейские, черепаха ускорилась и попыталась скрыться.",86,6.087,44100
1601,396829.wav,wavs\396829.wav,Во время траурного мероприятия в Нью-Йорке Клинтон резко стало плохо.,69,4.624,44100
1602,113791.wav,wavs\113791.wav,Санкции включают заморозку активов и ограничение доступа к финансовым учреждениям.,82,5.799,44100
1603,114868.wav,wavs\114868.wav,"Из аэропорта Бергамо можно добраться до Милана, из аэропорта Римини - до Рима.",78,6.113,44100
1604,084362.wav,wavs\084362.wav,"Группа туристов с экскурсоводом совершала прогулку на снегоходах, когда они заметили хищника.",93,5.851,44100
1605,478479.wav,wavs\478479.wav,"Диагноз ""психопат"", поставленный британскому премьеру учеными от журналистики, был опровергнут одним из ведущих психиатров страны, сообщает сайт ежедневной газеты Guardian.",172,11.285,44100
1606,204327.wav,wavs\204327.wav,"Об этом «Интерфаксу» в понедельник, двадцать первого ноября, сообщили в управлении Следственного комитета России СКР по Томской области.",136,9.874,44100
1607,149254.wav,wavs\149254.wav,"Бывший английский футболист Дэвид Бекхэм снялся в социальной рекламе ЮНИСЕФ, направленной на борьбу с насилием над детьми.",122,8.385,44100
1608,177225.wav,wavs\177225.wav,"Лента получила одиннадцать номинаций на «Оскар» и выиграла в шести, в том числе в категории «Лучший фильм».",107,7.837,44100
1609,011768.wav,wavs\011768.wav,Рано утром они были задержаны в Москве оперативниками и следователями ФСБ.,74,5.564,44100
1610,156721.wav,wavs\156721.wav,С две тысячи девятого года марши в честь латышских легионеров СС сопровождаются столкновениями между участниками шествий и антифашистами.,137,11.363,44100
1611,343903.wav,wavs\343903.wav,"Причиной аварии на шахте «Северная» в Воркуте является взрыв метана, заявила руководитель пресс-службы владеющей шахтой компании «Воркутауголь» Татьяна Бушкова.",160,13.74,44100
1612,210642.wav,wavs\210642.wav,Она родилась седьмого мая тысяча девятьсот шестьдесят третьего года в городе Темиртау Карагандинской области.,109,9.012,44100
1613,342515.wav,wavs\342515.wav,В тысяча девятьсот восемьдесят восьмой году он за семьдесят три дня проплыл из штата Массачусетс в США во Францию.,114,9.143,44100
1614,472051.wav,wavs\472051.wav,"В отличие от RQ-4 Global Hawk, стоимость китайского беспилотника составляет примерно сто долларов.",98,8.072,44100
1615,203902.wav,wavs\203902.wav,"В отличие от F-35, который считается ударным самолетом, F-22А - это истребитель, предназначенный для воздушных боев.",116,10.162,44100
1616,529254.wav,wavs\529254.wav,Об этом сообщает пресс-служба Генпрокуратуры Украины.,53,3.527,44100
1617,536365.wav,wavs\536365.wav,"Сам сосуд был обнаружен в две тысячи десятом году, однако очистили его только сейчас.",85,6.296,44100
1618,166814.wav,wavs\166814.wav,"Боевики утверждают, что в результате авиаудара двадцать восьмого марта ликвидированы были всего шесть или восемь их сторонников.",128,9.874,44100
1619,208800.wav,wavs\208800.wav,Корреспондентка британской газеты Daily Mail провела ночь в шведском ледяном отеле Icehotel.,92,7.288,44100
1620,449799.wav,wavs\449799.wav,"Астрофизики обнаружили одну из самых высокоэнергетических вспышек, когда-либо замеченных учеными.",97,7.105,44100
1621,246465.wav,wavs\246465.wav,"По подозрению в причастности к краже задержаны одиннадцать человек, работающих в грузовом терминале аэропорта.",110,8.307,44100
1622,111962.wav,wavs\111962.wav,"Кроме того, запрет распространяется на претендентов на выборные посты, от президента России до регионального депутата.",118,7.967,44100
1623,540868.wav,wavs\540868.wav,"Стогова также отметила, что ненавидит милиционеров.",51,4.075,44100
1624,539031.wav,wavs\539031.wav,На нем запечатлена сцена казни четырех мужчин.,46,3.239,44100
1625,190071.wav,wavs\190071.wav,"Как сообщил Устинов, завершено расследование по девяносто семь делам, пятьдесят семь из них направлены в суды.",110,8.255,44100
1626,041260.wav,wavs\041260.wav,Международный авиакосмический салон МАКС-2017 проходит в Жуковском с восемнадцать по двадцать третьего июля.,108,8.777,44100
1627,100977.wav,wavs\100977.wav,На лето две тысячи шестнадцатого года бронирование отелей упало на сорок процентов по сравнению с прошлым годом.,112,8.725,44100
1628,422071.wav,wavs\422071.wav,"Он сыграет немолодого графа, который принимает участие в престижной автомобильной гонке Le Mille Miglia «Тысяча миль».",118,9.091,44100
1629,453223.wav,wavs\453223.wav,Финч обратилась с жалобой в авиакомпанию.,41,3.605,44100
1630,476582.wav,wavs\476582.wav,Причина — срыв «Автокомпонентом» поставок деталей для боковых зеркал заднего вида.,82,6.531,44100
1631,527916.wav,wavs\527916.wav,"Если это правда, то это бред полнейший.",39,2.691,44100
1632,488723.wav,wavs\488723.wav,"Обладателем редкого доллара стал коллекционер, пожелавший остаться неназванным.",79,5.251,44100
1633,429816.wav,wavs\429816.wav,"Три следующих места также достались банкам КНР — China Construction Bank, Agricultural Bank of China и Bank of China.",117,9.561,44100
1634,109166.wav,wavs\109166.wav,За последние три-четыре года таких жалоб поступило около сотни.,63,4.78,44100
1635,475899.wav,wavs\475899.wav,"Кроме того, ""Челси"" находится в непростой ситуации перед последним туром группового турнира Лиги чемпионов.",107,7.602,44100
1636,223214.wav,wavs\223214.wav,"Он пояснил, что не может собрать достаточно средств на съемки крупнобюджетного кино, а малометражные фильмы его больше не интересуют.",133,11.233,44100
1637,267846.wav,wavs\267846.wav,"- Мне кажется, его появление в последней серии вполне закономерно и послужит для логической связи всей саги"".",109,8.594,44100
1638,025643.wav,wavs\025643.wav,"""Подозреваемым оказался двадцатьтрилетний ранее судимый за аналогичные преступления молодой человек, находящийся на условно-досрочном освобождении.",147,11.363,44100
1639,336661.wav,wavs\336661.wav,В США лента выйдет в ограниченный прокат во второй половине ноября.,67,4.78,44100
1640,292858.wav,wavs\292858.wav,"Также пострадали три ученика, которые получили травмы, выпрыгнув из окон.",73,5.433,44100
1641,341063.wav,wavs\341063.wav,"Первый сингл из альбома, песню, которая также носит название «Reflektor», Arcade Fire выпустили девятого сентября.",114,9.273,44100
1642,480151.wav,wavs\480151.wav,"В Приморском крае двадцать второго октября в результате ДТП погибли пять человек, еще восемь получили ранения.",110,9.012,44100
1643,209452.wav,wavs\209452.wav,"Кроме вице-премьера в списке кандидатур перечислены еще девять человек, в том числе и сейчас входящие в совет.",110,8.673,44100
1644,171693.wav,wavs\171693.wav,"седьмого февраля министр иностранных дел РФ Сергей Лавров посетил с визитом Дамаск, где провел переговоры с президентом Асадом.",127,10.684,44100
1645,242487.wav,wavs\242487.wav,"Однако большую его часть занимает национальный парк Лосиный остров, еще 10 процентов приходится на часть промышленной зоны «Калошино».",134,10.266,44100
1646,115080.wav,wavs\115080.wav,"Как пишет РИА Новости, тело было обнаружено в лесу на окраине столицы в районе Митино.",86,6.818,44100
1647,190269.wav,wavs\190269.wav,"Об этом он сказал в пятницу, пятнадцатого сентября, передает портал Tengrinews.kz.",82,6.922,44100
1648,276458.wav,wavs\276458.wav,Однако в своей статье Кашин не предъявил никаких обвинений в адрес главы региона.,81,6.165,44100
1649,528610.wav,wavs\528610.wav,"Первое место по числу коттеджных поселков в Московской области заняло Новорижское шоссе, где в настоящее время реализуется сто двадцать объектов.",145,11.311,44100
1650,336722.wav,wavs\336722.wav,"Один был убит для отбора проб ДНК, еще один - задавлен при кормлении.",69,5.46,44100
1651,495877.wav,wavs\495877.wav,"По результатам внутреннего расследования, проведенного компанией, драка действительно была и ее зачинщиком оказался сам Кларксон.",129,9.979,44100
1652,083231.wav,wavs\083231.wav,"Адвокат активиста заявляла, что будет обжаловать приговор.",58,3.527,44100
1653,187929.wav,wavs\187929.wav,"По информации следствия, двадцать второго сентября две тысячи двенадцатого года Максимов, в пьяном виде управляя «Тойотой», врезался в остановку на Минской улице.",162,12.774,44100
1654,239846.wav,wavs\239846.wav,"Башню Capital Plaza Office Tower вывели из эксплуатации в 2016-м, чтобы возвести на участке современное здание взамен устаревшего.",130,11.311,44100
1655,148532.wav,wavs\148532.wav,"Как сообщает Vallarta Daily, речь идет о местных жителях и туристах в штатах Колима, Халиско и Наярит.",102,8.124,44100
1656,278864.wav,wavs\278864.wav,"В министерстве рассчитывают на локализацию оборудования, что послужит укреплению экономических и технологических связей между нашими странами.",142,11.05,44100
1657,476653.wav,wavs\476653.wav,"Персонажи этих мультфильмов всенародно любимы, проверены временем, и мы надеемся, что товары с их изображением понравятся болельщикам.",134,10.397,44100
1658,430383.wav,wavs\430383.wav,"Первый этап визита главы России в Японию начался в четверг с города Нагато префектура Ямагути, затем он продолжится в Токио.",124,10.292,44100
1659,442711.wav,wavs\442711.wav,"Сейчас в трехэтажном особняке насчитывается пять двухместных спален, две ванные, две гостиные, кухня, хозяйственное помещение и две террасы.",140,11.52,44100
1660,174460.wav,wavs\174460.wav,"""На мой взгляд, по сравнению с прошлым годом у игроков значительно улучшились движение, техника, скорость"", - добавил Алханов.",126,12.434,44100
1661,406359.wav,wavs\406359.wav,Объем рынка медизделий в России составляет двести пятьдесят пять миллиардов рублей.,83,5.747,44100
1662,022345.wav,wavs\022345.wav,В ноябре две тысячи десятого года Viacom начала искать покупателя для студии Harmonix.,86,7.706,44100
1663,002891.wav,wavs\002891.wav,В апреле две тысячи девятого года против популярной телепередачи выступил министр внутренних дел РФ Рашид Нургалиев.,116,9.744,44100
1664,304710.wav,wavs\304710.wav,"Таким образом, наказание можно считать условным.",48,3.709,44100
1665,064273.wav,wavs\064273.wav,"пятнадцатого июля в рамках ""Проекта 35"" состоялась премьера фильма режиссера Патриса Леконта ""Откровенное признание"" Confidences trop intimes.",142,12.382,44100
