id,filename,path,text,num_chars,duration,sample_rate
1112,197459.wav,wavs\197459.wav,"Во-первых, было установлено, что ООО ПКФ ""Волга-Гарант"" имело право только на проектирование жилой застройки.",109,9.874,44100
1113,216949.wav,wavs\216949.wav,"Он подчеркнул, что животное не боялось ни шума, ни криков.",58,4.075,44100
1114,087539.wav,wavs\087539.wav,"По версии следствия, инцидент произошел вечером восемнадцатого мая в лесном массиве в Борском районе Самарской области.",119,8.202,44100
1115,473960.wav,wavs\473960.wav,В список попал и нидерландский аэропорт Принцессы Юлианы на берегу острова Сен-Мартен в Карибском море.,103,7.784,44100
1116,287167.wav,wavs\287167.wav,Начало сентября ознаменовалось печальным инцидентом.,52,3.657,44100
1117,035943.wav,wavs\035943.wav,"Отставка была инциирована премьер-министром Арсением Яценюком, обвинившим Шевченко в нарушении служебной этики и «поездках за рубеж в рабочее время».",149,11.416,44100
1118,095034.wav,wavs\095034.wav,"Пополам поделились предпочтения в отношении производителей детских смесей, чипсов и крекеров.",93,6.713,44100
1119,156860.wav,wavs\156860.wav,"Житель Казани придумал оригинальный способ поимки вора, ограбившего его квартиру.",81,5.669,44100
1120,383630.wav,wavs\383630.wav,"В перечне числятся сорок человек, среди которых Валентина Талызина, Наталья Варлей, Дмитрий Харатьян и Михаил Боярский.",119,9.613,44100
1121,137966.wav,wavs\137966.wav,"""Скажем так: в последнее время в администрации области было уволено большое количество людей.",93,6.766,44100
1122,187569.wav,wavs\187569.wav,Возобновление авиасообщения между Россией и Египтом начнется с Каира.,69,5.93,44100
1123,211452.wav,wavs\211452.wav,В две тысячи первом году Ломбардо вернулся в коллектив.,55,4.206,44100
1124,014052.wav,wavs\014052.wav,Проект киноконцертного зала Москомархитектура утвердила в две тысячи шестнадцатом году.,87,6.217,44100
1125,062689.wav,wavs\062689.wav,Организация «Спасители жизни» была основана в тысяча девятьсот девяносто шестой году в Алабаме.,95,7.131,44100
1126,022555.wav,wavs\022555.wav,"ЦСКА, одержав две победы в двух матчах, набрал шесть очков и возглавил турнирную таблицу чемпионата.",100,8.02,44100
1127,397512.wav,wavs\397512.wav,Нападающий санкт-петербургского СКА Илья Ковальчук рассказал о намерении остаться в команде на будущий сезон.,109,7.837,44100
1128,277893.wav,wavs\277893.wav,В тот момент он находился в алтайском селе Курай в Кош-Агачском районе.,71,5.381,44100
1129,300965.wav,wavs\300965.wav,Торги акциями АФК «Система» на Московской бирже с одиннадцать часов три минут по московскому времени возобновлены после приостановки с десять часов тридцать три минут по московскому времени.,190,13.793,44100
1130,316640.wav,wavs\316640.wav,"В том же месяце Apple, владеющая магазином App Store, подала в суд на Amazon.",77,5.93,44100
1131,320744.wav,wavs\320744.wav,В то же время ее финансовые отчеты многим кажутся неудовлетворительными.,72,5.564,44100
1132,277422.wav,wavs\277422.wav,"Испытания были прекращены в тысяча девятьсот восемьдесят девятом году, а в тысяча девятьсот девяносто первом году полигон был официально закрыт по решению казахстанских властей.",177,12.016,44100
1133,364998.wav,wavs\364998.wav,В прошлом году во время осеннего призыва ряды ВС пополнили сто пятьдесят два тысячи человек.,92,8.176,44100
1134,203170.wav,wavs\203170.wav,Министерство обороны Украины закрыло проект разработки оперативно-тактического ракетного комплекса «Сапсан».,108,8.255,44100
1135,395082.wav,wavs\395082.wav,Сессия на рынке была продлена до девятнадцать часов двадцать пять минут.,72,4.728,44100
1136,027727.wav,wavs\027727.wav,"Об этом сообщили в Главном следственном управлении Следственного комитета СК по Московской области, передает ТАСС.",114,8.385,44100
1137,413803.wav,wavs\413803.wav,"Ценные бумаги из индекса РТС-2 по-прежнему не пользуются спросом, что и позволило РТС обогнать РТС-2.",101,8.673,44100
1138,110004.wav,wavs\110004.wav,В июне «Манчестер Юнайтед» отказался продлевать однолетний контракт с Ибрагимовичем.,84,6.034,44100
1139,051241.wav,wavs\051241.wav,"Об этом в четверг, девятого ноября, рассказала «Ленте.ру» официальный представитель управления Следственного комитета России СКР по Новгородской области Анастасия Садриева.",172,12.539,44100
1140,418153.wav,wavs\418153.wav,В возрасте двадцать лет она поступила в труппу Большого драматического театра.,78,5.146,44100
1141,468460.wav,wavs\468460.wav,"На сегодняшний день российский арсенал нестратегических боеголовок насчитывает от четырех до пятнадцать тысяч боеголовок, американский - около 1600.",148,12.669,44100
1142,127346.wav,wavs\127346.wav,"Взамен него Медведев, по данным сайта, завел себе кота той же породы по кличке Енисей.",86,7.367,44100
1143,197617.wav,wavs\197617.wav,В полицию стали поступать сообщения о стрельбе.,47,3.344,44100
1144,038383.wav,wavs\038383.wav,В то же время власти и оппозиционеры Пензы смогли договориться о месте проведения акции.,88,6.949,44100
1145,460622.wav,wavs\460622.wav,Преступников сыграют участники группы Die Antwoord — Йоланди Фиссер настоящее имя Анри Дю Туа и Ниндзя Уоткин Тюдор Джонс.,122,11.363,44100
1146,071493.wav,wavs\071493.wav,"Об этом сообщается в пресс-релизе компании Skyscanner, поступившем в редакцию «Ленты.ру» двадцать пятого мая.",109,11.05,44100
1147,526442.wav,wavs\526442.wav,Дальневосточная сардина являлась промысловой рыбой.,51,4.127,44100
1148,495488.wav,wavs\495488.wav,Прибывшие на место полицейские проникли в дом через окно и обнаружили его с огнестрельным ранением головы.,106,7.367,44100
1149,422492.wav,wavs\422492.wav,В Перми неизвестный мужчина спустился по фасаду 16-этажного жилого дома.,72,6.113,44100
1150,398029.wav,wavs\398029.wav,"Как отмечает газета, владельцы жилья на Бали в целом зарабатывают больше других.",80,5.564,44100
1151,003054.wav,wavs\003054.wav,Однако наибольший рост наблюдается в сегментах одежды и обуви.,62,4.728,44100
1152,380915.wav,wavs\380915.wav,"Спасибо ""Локомотиву""», — заявил футболист.",42,3.187,44100
1153,215560.wav,wavs\215560.wav,В парке авиакомпании насчитывается восемнадцать самолетов Boeing 737-800.,73,7.419,44100
1154,226653.wav,wavs\226653.wav,"Правительство Австралии ввело шестимесячный запрет на продажу и потребление алкоголя в районах, где проживают австралийские аборигены, передает BBC News.",153,10.945,44100
1155,464806.wav,wavs\464806.wav,"По другим направлениям союз заработал 34,4 миллиона евро.",57,5.329,44100
1156,536859.wav,wavs\536859.wav,"Основными претендентами на титул, кроме армейцев, Березуцкий назвал питерский «Зенит» и столичный «Локомотив».",110,8.856,44100
1157,177192.wav,wavs\177192.wav,"Об этом пишет газета Los Angeles Times.Общая площадь дома, построенного в тысяча девятьсот шестьдесят девятом году и впоследствии реконструированного, превышает двести шестьдесят квадратных метров.",197,16.065,44100
1158,033402.wav,wavs\033402.wav,"«Услуги по передаче мгновенных сообщений будут предоставляться исключительно пользователям, идентифицированным на основании абонентского номера и соответствующего договора», — отметил генпрокурор.",196,13.74,44100
1159,246469.wav,wavs\246469.wav,"Это высказывание отличается от того, что Матвиенко говорила ранее.",66,4.206,44100
1160,422657.wav,wavs\422657.wav,"Ракетное и бомбовое вооружение размещается во внутренних отсеках, вес боевой нагрузки составляет две тысячи двести шестьдесят восемь килограммов.",145,10.867,44100
1161,333375.wav,wavs\333375.wav,"Еще около двадцать тысяч распространяются по сниженной цене например, по подписке.",82,6.504,44100
1162,369549.wav,wavs\369549.wav,"Возможно, причиной суицида паралимпийца стало тяжелое психическое состояние.",76,5.564,44100
1163,394657.wav,wavs\394657.wav,"Поправка: в пресс-службе «Роснефти» опровергли информацию агентства, заявив, что компания проводит работы в Карском море с опережением графика.",143,10.71,44100
1164,063201.wav,wavs\063201.wav,"Шаповал - доктор юридических наук, член-корреспондент Академии правовых наук Украины.",85,6.87,44100
1165,378925.wav,wavs\378925.wav,С мая две тысячи шестой года они официально живут раздельно.,60,4.911,44100
1166,532688.wav,wavs\532688.wav,"В ДТЭК отметили, что спор вызван национализацией инвестиций компании на территории Крыма.",89,6.165,44100
1167,156336.wav,wavs\156336.wav,"Кроме того, в смоленской думе есть один независимый депутат.",60,4.598,44100
1168,436494.wav,wavs\436494.wav,"Представители профсоюза заявили, что неофициальную позицию ректора преподавателям озвучила декан психолого-социального факультета Нелли Снежкова.",145,11.781,44100
1169,175908.wav,wavs\175908.wav,"Правоохранительные органы не исключают, что мужчина тысяча девятьсот семьдесят седьмой года рождения может иметь отношение и к другим убийствам, совершенным в Забайкалье.",170,12.199,44100
1170,085245.wav,wavs\085245.wav,"Из-за снижения цен впервые за два года доля оформляемых на «Туту.ру» авиабилетов за рубеж стала расти, отметили представители сервиса.",134,10.449,44100
1171,432905.wav,wavs\432905.wav,"По его словам, среди возможных способов их приватизации может быть размещение акций на открытом рынке или продажа стратегическим инвесторам.",140,10.449,44100
1172,503145.wav,wavs\503145.wav,"За последние 4,5 года активно приобретались веб-камеры, что связано с ростом популярности домашнего видео и видеозвонков в России.",130,10.475,44100
1173,115939.wav,wavs\115939.wav,"При нем было обнаружено 3,9 грамма марихуаны.",45,4.415,44100
1174,494163.wav,wavs\494163.wav,План этой операции был окончательно утвержден на ночном заседании совета безопасности Израиля.,94,7.602,44100
1175,211178.wav,wavs\211178.wav,Распоряжение о внесении проекта в Думу было опубликовано на сайте правительства двадцать восьмого ноября.,105,7.471,44100
1176,495179.wav,wavs\495179.wav,"Переход планируется осуществить летом две тысячи двенадцатого года, то есть чемпионат России - две тысячи одиннадцать продлится полтора года.",141,10.945,44100
1177,396184.wav,wavs\396184.wav,К пятнадцать часов ноль минут Як-42 уже убрали со взлетно-посадочной полосы.,76,6.296,44100
1178,087311.wav,wavs\087311.wav,"После серии удачных матчей команда сумела навязать ""Интеру"" борьбу за чемпионство и в итоге заняла второе место.",112,8.49,44100
1179,105675.wav,wavs\105675.wav,"Меджитов также входит в десятку самых известных ученых российского происхождения, составленную журналом Forbes.",111,7.288,44100
1180,107660.wav,wavs\107660.wav,Житель села Булгунняхтах в Хангаласском районе Якутии расстрелял соседей и покончил с собой.,92,7.184,44100
1181,299037.wav,wavs\299037.wav,"Наружным операторам не удастся избежать проведения массовых торгов на размещение рекламных конструкций после 2011-две тысячи двенадцатого годаодов, пишет газета ""Коммерсант"".",174,12.983,44100
1182,134435.wav,wavs\134435.wav,"Крупные мебельные компании, в том числе шведская IKEA, закупают древесину, изготовленную из незаконно вырубленных румынских лесов.",130,9.613,44100
1183,171583.wav,wavs\171583.wav,"В мае пользователи Twitter начали активно обсуждать твит президента США, в котором содержалась недописанная фраза с опечатками.",127,10.031,44100
1184,127161.wav,wavs\127161.wav,"Предположительно, Павлов скончался от остановки сердца.",55,4.206,44100
1185,094510.wav,wavs\094510.wav,"По словам Стиглица, на практике эта система обернулась тем, что банкиры соглашались проводить чрезмерно рисковые операции.",122,8.803,44100
1186,485316.wav,wavs\485316.wav,"Жительница американского города Сиэтл, которая страдает от синдрома кошачьего глаза, приняла участие в фотосессии для журнала V Magazine.",137,9.848,44100
1187,284851.wav,wavs\284851.wav,"Предыдущее достижение принадлежало украинскому альпинисту Владимиру Моногарову, который в две тысячи шестой году покорил Эльбрус в возрасте восемьдесят лет.",156,11.886,44100
1188,432776.wav,wavs\432776.wav,"Россия же заняла 23-е место, оказавшись между Германией и Швецией.",66,5.747,44100
1189,495451.wav,wavs\495451.wav,"""Банк не несет ответственности за сохранность депозитов внутри сейфа, он отвечает, только если ячейка была взломана"", - сказал менеджер банка.",142,11.18,44100
1190,517867.wav,wavs\517867.wav,"Об этом говорится в пресс-релизе «России», поступившем в редакцию «Ленты.ру».",77,8.542,44100
1191,122100.wav,wavs\122100.wav,"В марте 2015-го Adidas объявил, что не намерен продлевать отношения с НБА.",74,6.4,44100
1192,536141.wav,wavs\536141.wav,Хеллоуин официально начал отмечаться во Франции в тысяча девятьсот девяносто девятом году.,90,5.747,44100
1193,068238.wav,wavs\068238.wav,"При этом ""оптимальный"" уровень, к которому стремились страны ОПЕК, составлял двадцать один доллар за баррель.",109,8.255,44100
1194,421145.wav,wavs\421145.wav,Нынешнее соглашение аргентинца с клубом рассчитано до две тысячи двадцать первого года.,87,6.4,44100
1195,201184.wav,wavs\201184.wav,FreeSavchenko— Николай Полозов Moscowadvokat 14 Март две тысячи пятнадцать Врачи сказали Надежде о крайней нежелательности возобновления ею голодовки.,150,15.229,44100
1196,295837.wav,wavs\295837.wav,"Кутышев погиб на месте, Макаренко скончалась на операционном столе.",67,4.911,44100
1197,036488.wav,wavs\036488.wav,"Его состояние оценивается в 45,6 миллиарда долларов.",52,5.016,44100
1198,516292.wav,wavs\516292.wav,"Два спутника военного назначения, запущенные пятого декабря с космодрома Плесецк на новой ракете «Союз-2.1В», доставлены на орбиту блоком выведения «Волга».",156,13.793,44100
1199,371103.wav,wavs\371103.wav,"Федеральное агентство по управлению госимуществом владеет пятьдесят один процентом уставного капитала, около тридцать пять процентов контролирует «Ренова-Оргсинтез».",165,14.211,44100
1200,500948.wav,wavs\500948.wav,Об этом «Ленте.ру» второго февраля сообщили в пресс-службе театра.,66,5.042,44100
1201,465910.wav,wavs\465910.wav,Наметилась позитивная динамика и в демографической сфере: третий год рождаемость превышает смертность.,102,7.941,44100
1202,433854.wav,wavs\433854.wav,"Согласно официальному сайту ""Редмедиа"", редакция телекомпании располагается неподалеку от Первой Останкинской улицы - на улице Академика Королева.",146,11.233,44100
1203,204473.wav,wavs\204473.wav,"Он зашел в воду на пляже, после чего неожиданно обмяк и упал.",61,4.545,44100
1204,514543.wav,wavs\514543.wav,Бородин требует от Банка Москвы компенсацию за досрочное расторжение договора.,78,5.982,44100
1205,389844.wav,wavs\389844.wav,В случае отказа боевики угрожали убить заложника.,49,3.892,44100
1206,324415.wav,wavs\324415.wav,"По информации телеканала НТВ Плюс, спортсменка вернула медаль и полагающийся вместе с ней диплом.",97,7.34,44100
1207,105550.wav,wavs\105550.wav,"О своем банкротстве заявили многие крупнейшие инвестфонды США, а инвесторы со всего мира понесли многомиллиардные потери.",121,8.803,44100
1208,082689.wav,wavs\082689.wav,"За последние тридцать шесть лет непрерывных афганских войн «никогда не было лучших условий для мира», сказал Гани.",114,8.542,44100
1209,086055.wav,wavs\086055.wav,"Он соединяет Лаврушинский переулок с Болотной площадью, проходя над Водоотводным каналом.",89,7.105,44100
1210,489201.wav,wavs\489201.wav,"Слабые измерения отличаются от обычных тем, что вносят слабые изменения, которые ниже общего ""фонового"" шума.",109,9.273,44100
1211,334452.wav,wavs\334452.wav,Здание совместного российско-китайского университета в городе Шэньчжэнь станет копией МГУ.,90,6.583,44100
1212,285400.wav,wavs\285400.wav,Устроенный на этих принципах генератор авторы понимают как собранный в панели массив большого количества микроскопических диодно-резисторных цепей.,147,11.363,44100
1213,245696.wav,wavs\245696.wav,"Группа ""Базовый Элемент"" Олега Дерипаски завершила реорганизацию своего строительного сектора.",94,6.87,44100
1214,087724.wav,wavs\087724.wav,Женщине грозит до десять лет тюрьмы.,36,2.952,44100
1215,232614.wav,wavs\232614.wav,Параллельно с проведением испытаний осуществляется разработка авиационных средств поражения для перспективного истребителя.,123,8.438,44100
1216,534585.wav,wavs\534585.wav,Очки носят более трети принявших участие в опросах.,51,3.579,44100
1217,463227.wav,wavs\463227.wav,Абрамян поблагодарил Россию за предоставление государственного экспортного кредита для финансирования поставок вооружения Армении.,130,9.509,44100
1218,180064.wav,wavs\180064.wav,"Причем методы, применяемые ШПЛС, часто лежат вне правового поля.",64,5.851,44100
1219,452380.wav,wavs\452380.wav,Мыши из обеих групп никогда не встречались с хищниками.,55,4.31,44100
