id,filename,path,text,num_chars,duration,sample_rate
560,230916.wav,wavs\230916.wav,"И на его место поставили того Юрия Севрука — прим. «Ленты.ру», кому на то время доверяли», — добавил Байден.",108,8.49,44100
561,455271.wav,wavs\455271.wav,"В две тысячи пятнадцатом году правительство Украины инициировало денонсацию соглашения, а Рада поддержала это предложение.",122,9.273,44100
562,099799.wav,wavs\099799.wav,Иосиф Кобзон является уроженцем Донецкой области.,49,4.493,44100
563,392943.wav,wavs\392943.wav,"Как передает агентство ""Интерфакс"", соответствующий указ президент ПМР Игорь Смирнов подписал еще накануне.",107,8.02,44100
564,088842.wav,wavs\088842.wav,Комплекс рассчитан на сто восемьдесят восемь квартир площадью от сорок семь до сто одиннадцать квадратных метров.,113,7.602,44100
565,451755.wav,wavs\451755.wav,Двое из осужденных получили пожизненные сроки.,46,3.709,44100
566,149950.wav,wavs\149950.wav,"При этом причастность к инциденту Свободной сирийской армии, которую официально поддерживают западные страны, кажется Human Rights Watch недоказанной.",150,11.729,44100
567,207631.wav,wavs\207631.wav,"По словам спортсменки, она вместе с партнером старалась ничего не читать перед соревнованиями.",94,6.269,44100
568,221394.wav,wavs\221394.wav,В соседних с вулканом поселках прошли пеплопады.,48,3.788,44100
569,271306.wav,wavs\271306.wav,"Черная надпись на белом фоне гласит: ""Это последняя страница.",61,4.833,44100
570,303162.wav,wavs\303162.wav,Судья удовлетворила просьбу прокурора и объявила перерыв в процессе до пятого февраля.,86,6.165,44100
571,428347.wav,wavs\428347.wav,Расмус Эльм перешел в ЦСКА в две тысячи двенадцатом году.,57,4.728,44100
572,460292.wav,wavs\460292.wav,"Обычно девочки перестают быть богинями, когда происходит половое созревание.",76,5.381,44100
573,190853.wav,wavs\190853.wav,"Об этом в пятницу, десятого ноября, «Ленте.ру» рассказал глава пресс-службы управления МВД России по Свердловской области Валерий Горелых.",138,12.774,44100
574,384766.wav,wavs\384766.wav,Из-за падения нефтяных котировок параметры бюджета могут быть пересмотрены.,75,5.016,44100
575,373335.wav,wavs\373335.wav,"По предварительной версии следствия, бутылку со смертельно опасной жидкостью потерпевшему подарили его родственники.",116,8.124,44100
576,091522.wav,wavs\091522.wav,"Американец, личность которого не раскрывается, проник в отель, находясь под воздействием различных наркотических веществ, в частности галлюциногенных грибов.",157,11.311,44100
577,046393.wav,wavs\046393.wav,"Бывший депутат Тульской областной думы, генеральный директор торговой сети «СПАР.",81,6.531,44100
578,060012.wav,wavs\060012.wav,"Ранее сообщалось, что аварийное состояние замка стало причиной для закрытия объекта для посещений.",98,7.131,44100
579,309832.wav,wavs\309832.wav,"Бондерман принес извинения, подчеркнув, что берет на себя ответственность за случившееся.",89,5.799,44100
580,340369.wav,wavs\340369.wav,"После каждого расплавления специальное устройство утапливает «напечатанный» слой в порошок, одновременно нанося поверх него новый слой металла для спекания.",156,11.546,44100
581,390629.wav,wavs\390629.wav,При определенных климатических условиях заход на аэродром осуществляется с севера.,82,6.087,44100
582,422107.wav,wavs\422107.wav,Попытки уговорить злоумышленника сдаться и выпустить сына длились восемь часов.,79,5.982,44100
583,184482.wav,wavs\184482.wav,Самое большое в мире колесо обозрения появится в столице Китая.,63,4.859,44100
584,160981.wav,wavs\160981.wav,"Подписи под документами поставили премьер-министры Грузии и Молдавии Ираклий Гарибашвили и Юрий Лянкэ, а также президент Украины Петр Порошенко.",144,11.468,44100
585,446963.wav,wavs\446963.wav,Сезон стартует осенью две тысячи пятнадцатого года.,51,4.206,44100
586,424797.wav,wavs\424797.wav,"Кроме того, он может быть причастен к убийству еще одной женщины, пропавшей без вести.",86,6.113,44100
587,434931.wav,wavs\434931.wav,"Пошивай жив и вышел на связь, а судьба Евстратикова неизвестна.",63,4.362,44100
588,360557.wav,wavs\360557.wav,В Санкт-Петербурге и на северо-западе страны наиболее популярным стал фильм Кристофера Нолана «Начало».,103,8.307,44100
589,122260.wav,wavs\122260.wav,"С точки зрения АРБ, необходимо создавать региональные банки, чтобы обеспечить доступность банковских услуг для населения в регионах.",132,9.613,44100
590,420185.wav,wavs\420185.wav,"Железногорское НПО прикладной механики им.Решетнева под Красноярском приняло решение использовать спутники ""Глонасс-М"", помимо их основного назначения, в качестве ""космических почтальонов"".",189,14.655,44100
591,159456.wav,wavs\159456.wav,Они будут нести службу до завершения ночных богослужений.,57,3.84,44100
592,104073.wav,wavs\104073.wav,«Tic Tac уважает всех женщин.,29,2.325,44100
593,292349.wav,wavs\292349.wav,Замыкает первую тройку Kia Rio — двести девяносто восемь краж.,62,5.747,44100
594,121928.wav,wavs\121928.wav,"Энергия, которая необходима для квантового туннелирования, достигает значений ста миллиардов гигаэлектронвольт.",111,7.784,44100
595,003355.wav,wavs\003355.wav,"Об этом в четверг, двадцать пятого августа, сообщает Spiegel online.",68,5.747,44100
596,221081.wav,wavs\221081.wav,"Ученые попытались составить модель разрушения озона, которая смогла бы предсказать динамику этого процесса.",107,8.307,44100
597,527093.wav,wavs\527093.wav,пятнадцатого ноября о необходимости объединения НАТО с Россией против ИГ заявил бывший главнокомандующий Североатлантического альянса в Европе Джеймс Ставридис.,160,13.192,44100
598,122708.wav,wavs\122708.wav,Он проходит по делу о конфликте у ресторана Elements на Рочдельской улице.,74,5.669,44100
599,449880.wav,wavs\449880.wav,Теперь друзья смогут видеться в любое время суток через ограду.,63,4.023,44100
600,486925.wav,wavs\486925.wav,"По его словам, Магуриной и другим недовольным помогает профсоюз летного состава, который «себя абсолютно дискредитировал».",122,8.725,44100
601,180393.wav,wavs\180393.wav,В результате столкновений президент Украины Виктор Янукович был вынужден покинуть страну в феврале две тысячи четырнадцатого года.,130,9.848,44100
602,064594.wav,wavs\064594.wav,Взятые пробы позволили ученым реконструировать экологические условия в Австралии за последние сто пятьдесят тысяч лет.,118,9.038,44100
603,284420.wav,wavs\284420.wav,"Как будет удобно на первоначальном этапе нашим партнерам из Евросоюза», — заявил чиновник.",90,10.292,44100
604,167063.wav,wavs\167063.wav,"По словам Артемьева, на этом совещании были оформлены сроки принятия решений по запуску биржевой торговли нефтепродуктами.",122,8.594,44100
605,242677.wav,wavs\242677.wav,"В Алтайском крае в понедельник, восьмого июля, открылся музей гуся, сообщает ИТАР-ТАСС со ссылкой на директора выставочного зала Сергея Неверова.",145,11.833,44100
606,323593.wav,wavs\323593.wav,Об этом говорится в сообщении компании «ИНКОМ-Недвижимость».,60,5.094,44100
607,421300.wav,wavs\421300.wav,На сайте театра администрация приносит свои извинения зрителям и предлагает вернуть билеты.,91,7.053,44100
608,313718.wav,wavs\313718.wav,"Голкипер московского ЦСКА Илья Брызгалов заявил, что ему мешает общаться с прессой скафандр, который он носит в Центре управления полетов.",138,9.927,44100
609,038372.wav,wavs\038372.wav,"В акции участвовали депутаты фракций «Батькивщина», «УДАР» и «Свободы», выступающие в качестве оппозиции правящей Партии регионов.",130,10.945,44100
610,229402.wav,wavs\229402.wav,"Рекорд был установлен еще двадцать второго августа, однако официально редакция Книги рекордов России признала его только сейчас.",128,9.273,44100
611,318221.wav,wavs\318221.wav,Машина будет оснащаться различными типами вооружения и разведывательной аппаратуры.,83,5.381,44100
612,443708.wav,wavs\443708.wav,"Давайте мы проанализируем среднюю стоимость, которая составляет 20-30 долларов, и сделаем хотя бы на уровне средней», — уточнил Сафонов.",136,10.397,44100
613,011493.wav,wavs\011493.wav,"В сентябре 2014-го сообщалось, что власти намерены ликвидировать Калачи, которое известно в СМИ как «сонное село».",114,9.796,44100
614,410426.wav,wavs\410426.wav,Научно-производственная корпорация «Уралвагонзавод» рассекретила некоторые материалы о выпуске основных боевых танков Т-72 в СССР и России.,139,14.994,44100
615,162378.wav,wavs\162378.wav,Им стал политический неологизм из пятьдесят один буквы.,55,4.545,44100
616,420765.wav,wavs\420765.wav,Спустя несколько дней специализированные магазины сообщили о дефиците каннабиса.,80,5.512,44100
617,245149.wav,wavs\245149.wav,Федеральная антимонопольная служба ФАС России подвела итоги проверки деятельности компаний Lenovo и HP и заявила о наличии признаков картельного сговора.,153,12.382,44100
618,247554.wav,wavs\247554.wav,"Об этом во вторник, двенадцатого апреля, сообщает The Independent.",66,4.023,44100
619,282118.wav,wavs\282118.wav,"Финальное трехчасовое шоу, в котором участвовали восемьдесят шесть претенденток со всего мира, проходило в филиппинской столице Маниле в понедельник, тридцатого января.",168,11.833,44100
620,457253.wav,wavs\457253.wav,Модернизированный Су-25 может пролететь без дозаправки одна тысяча восемьсот пятьдесят километров.,98,7.471,44100
621,252729.wav,wavs\252729.wav,"Ранее ФРГ выдала ордер на арест Бродского, который четвертого июля был задержан в аэропорту Варшавы.",100,8.359,44100
622,086667.wav,wavs\086667.wav,"Представители Activision не уточнили, будут ли зомби в новой игре опять нацистами.",82,5.93,44100
623,467947.wav,wavs\467947.wav,"Кроме того, недавно вышло продолжение еще одной легендарной игры - Quake.",73,5.799,44100
624,051260.wav,wavs\051260.wav,"Дело в том, что на раскатке партнерша получила серьезную травму, передает AFP.",78,6.452,44100
625,250685.wav,wavs\250685.wav,"Правда, в начале второй половины игры, на 47-й минуте хозяева поля отыгрались.",78,6.583,44100
626,380750.wav,wavs\380750.wav,"Дата общественных слушаний по ""Охта-центру"" бывший ""Газпром-сити"" предварительно назначена на четырнадцатого января две тысячи восьмой года.",140,10.162,44100
627,217403.wav,wavs\217403.wav,"Общественность осудила тогда сделку, поскольку признанные шедевры оказались выведенными из публичного фонда.",108,7.758,44100
628,505098.wav,wavs\505098.wav,С тех пор кошачий пляж привлекает тысячи туристов со всего света.,65,4.415,44100
629,455521.wav,wavs\455521.wav,"Чиновник просил избрать ему меру пресечения, не связанную с лишением свободы, и уверял, что скрываться от следствия не собирается.",130,9.012,44100
630,006260.wav,wavs\006260.wav,"По данным ""Интерфакса"", это статья 159, часть третья УК РФ - мошенничество, совершенное группой лиц.",100,9.874,44100
631,282074.wav,wavs\282074.wav,Изобретатель Скотт Уайт подал в окружной суд Чикаго иск к производителю соусов Heinz.,85,6.687,44100
632,410818.wav,wavs\410818.wav,В октябре две тысячи семнадцатого года средняя стоимость квадратного метра на вторичном рынке жилья Москвы составила двести шестнадцать тысяч рублей.,149,12.121,44100
633,399298.wav,wavs\399298.wav,Пол Ньюман и Тони Скотт встречались и вели переговоры о роли.,61,4.624,44100
634,400939.wav,wavs\400939.wav,Начало экспорта машкомплектов запланировано на две тысячи семнадцатого годаод.,78,5.277,44100
635,217875.wav,wavs\217875.wav,"Последний, как отмечает ИА REGNUM, будет состоять из членов Президентского совещания, а также из премьер-министра и спикера парламента.",135,10.344,44100
636,151307.wav,wavs\151307.wav,"По его словам, они пройдут по пропорциональной системе.",55,3.709,44100
637,521973.wav,wavs\521973.wav,Из-за кризиса на финансовом рынке Citigroup был вынужден списать двадцать два миллиарда долларов безнадежных долгов.,116,8.202,44100
638,213455.wav,wavs\213455.wav,"Начиная с две тысячи тринадцатого года отечественный авторынок покинуло несколько автобрендов — Opel, Chevrolet, Dodge и Seat.",126,9.979,44100
639,493748.wav,wavs\493748.wav,"В Вильнюсе в субботу, четырнадцатого мая, за демонстрацию советской символики был задержан гражданин Эстонии.",109,7.706,44100
640,344434.wav,wavs\344434.wav,"По информации «Коммерсанта», строительство обошлось Минобороны более чем в двадцать миллиардов рублей.",102,7.889,44100
641,049793.wav,wavs\049793.wav,"«Нужно все-таки перешагнуть, сделать какой-то шаг вперед, не жить фобиями прошлого, а смотреть в будущее», — сказал Путин.",122,8.803,44100
642,150877.wav,wavs\150877.wav,"По сообщениям СМИ, радиопередача была зафиксирована еще в четверг, шестнадцатого октября.",89,6.87,44100
643,261483.wav,wavs\261483.wav,"Функция пропуска рекламы уже имеется в ряде телеустройств: в частности, в плеерах TiVo и ReplayTV.",98,7.654,44100
644,404588.wav,wavs\404588.wav,Он открыл огонь по автомобилю и скрылся.,40,3.37,44100
645,255404.wav,wavs\255404.wav,"Компания Sony в ноябре представит в Японии новую версию игровой системы PlayStation 2, дебютировавшей на рынке семь лет назад.",126,9.848,44100
646,097070.wav,wavs\097070.wav,"В результате исследования удалось установить, что артефакты были изначально раскрашены различными цветами и покрыты позолотой.",126,9.326,44100
647,058198.wav,wavs\058198.wav,"По его словам, распространение огня удалось остановить в пятнадцать часов двадцать восемь минут по московскому времени.",119,8.307,44100
648,127829.wav,wavs\127829.wav,"С две тысячи по две тысячи пятого годаоды Глеб уже играл за ""Штутгарт"".",71,5.251,44100
649,050337.wav,wavs\050337.wav,В начале марта воздушная гавань в Сочи была названа одной из лучших в Европе.,77,6.348,44100
650,183548.wav,wavs\183548.wav,В декабре две тысячи семнадцатого года индийская актриса стала жертвой домогательств со стороны мужчины средних лет.,116,9.195,44100
651,519815.wav,wavs\519815.wav,Известность Балону принесла роль капитана гвардейцев кардинала Жюссака в фильме «Д'Артаньян и три мушкетера» режиссера Георгия Юнгвальд-Хилькевича.,147,12.382,44100
652,449363.wav,wavs\449363.wav,Сайт The Village появился в апреле две тысячи десятого года как блог о городской жизни в рамках интернет-проекта Look At Me.,124,9.326,44100
653,077466.wav,wavs\077466.wav,"Комментируя уничтожение самолета, Путин пообещал серьезные последствия для связей между Москвой и Анкарой.",106,8.359,44100
654,424272.wav,wavs\424272.wav,"Однако в описании к снимку пользователи сети обнаружили, что он был сделан на профессиональную камеру Canon EOS 5D Mark III.",124,9.848,44100
655,448347.wav,wavs\448347.wav,"""Валенсия"" набрала двадцать один очко и переместилась на четвертое место в турнирной таблице.",93,6.296,44100
656,053308.wav,wavs\053308.wav,Минэкономразвития России МЭР не намерено поддерживать экспорт отечественных автомобилей в Казахстан.,100,7.837,44100
657,194187.wav,wavs\194187.wav,"Об этом сообщается в пресс-релизе гостиницы, поступившем в редакцию «Ленты.ру» во вторник, двадцать девятого декабря.",117,8.49,44100
658,158363.wav,wavs\158363.wav,"Необходимые для поездки пять тысяч семьсот долларов старику предоставил британский бизнесмен, который прочел историю Мийана.",124,9.091,44100
659,021039.wav,wavs\021039.wav,"В январе очевидцы рассказали подробности драки, произошедшей на борту российского лайнера, который вылетал из мексиканского Канкуна в Москву.",141,9.378,44100
660,389702.wav,wavs\389702.wav,"По словам источника в силовых структурах КБР, Джаппуев был убит в ходе ночной спецоперации.",91,7.288,44100
661,374420.wav,wavs\374420.wav,"По версии следствия, он заранее оставил ключ от хранилища на оконной решетке, затем вернулся ночью и забрал девятьсот семьдесят тысяч рублей.",141,10.762,44100
662,273242.wav,wavs\273242.wav,"Храм загорелся около шести утра первого сентября, о возгорании в МЧС сообщила местная жительница.",97,7.471,44100
663,098406.wav,wavs\098406.wav,"Соответствующее предложение правительства, как сообщает РИА Новости, было подписано двадцать четвертого сентября две тысячи десятого года.",138,11.05,44100
664,471893.wav,wavs\471893.wav,Прокуратура подмосковного города Егорьевск выявила факт незаконного захвата земельных участков владельцами частных домов в деревне Юрьево.,138,10.162,44100
665,281834.wav,wavs\281834.wav,До конца года на предприятии также начнется выпуск седана Lada Vesta.,69,5.878,44100
666,105590.wav,wavs\105590.wav,"Об этом сообщает ""Обком"" со ссылкой на Zaxid.net.",49,3.788,44100
667,415157.wav,wavs\415157.wav,"Об этом сообщает ""РБК daily"".",29,2.586,44100
668,360979.wav,wavs\360979.wav,"Напомним, что Адамов был задержан, когда прибыл для дачи показаний по поводу ареста счетов его дочери - гражданки Швейцарии.",124,8.62,44100
669,379390.wav,wavs\379390.wav,"За эти деньги пассажир может взять на борт десять килограммов ручной клади, багаж придется оплачивать отдельно.",111,7.889,44100
